,№,Topic,label,Solution,edited_issue_text
0,8,I have problems with my laptop. It keeps freezing and crashing and I have tried everything to fix it. Can you help?,Support,Run antivirus check and follow the antivirus' instructions. Let me know of the results.,have problems with my laptop it keeps freezing and crashing and have tried everything to fix it can help
1,104,"I have a problem with the sound on my computer. I checked the settings and everything is fine, but I still can't hear anything.",Hardware,Check if the current version of the device driver is installed. Detailed instructions are posted on the portal.,have problem with the sound on my computer checked the settings and everything fine but still can't hear anything
2,108,"I have a problem with the camera on my computer. I checked the settings and everything is fine, but I still don't see anything.",Hardware,Check if the current version of the device driver is installed. Detailed instructions are posted on the portal.,have problem with the camera on my computer checked the settings and everything fine but still don't see anything
3,112,"I have a problem with the microphone on my computer. I checked the settings and everything is fine, but I still can't hear anything.",Hardware,Check if the current version of the device driver is installed. Detailed instructions are posted on the portal.,have problem with the microphone on my computer checked the settings and everything fine but still can't hear anything
4,170,I'm having trouble accessing certain websites on my computer.,Network,Please specify the exact websites you are trying to access. It is possible that these sites are unreachable from our company's network.,having trouble accessing certain websites on my computer
5,173,My computer is having sound problems.,Hardware,Check if the current version of the device driver is installed. Detailed instructions are posted on the portal.,my computer having sound problems
6,179,I have a problem with the screen resolution on my computer.,Hardware,Check if the current version of the device driver is installed. Detailed instructions are posted on the portal.,have problem with the screen resolution on my computer
7,236,I can't use the software due to a hardware problem. I need help finding a solution.,Hardware,Please contact the workstation support service,can't use the software due to hardware problem need help finding solution
8,265,I can't print from my computer. It's been a problem for a few days now.,Support,Follow this instruction and let me know the results: https://support.microsoft.com/en-us/windows/fix-printer-connection-and-printing-problems-in-windows-fb830bff-7702-6349-33cd-9443fe987f73,can't print from my computer it's been problem for few days now
9,268,I am having trouble accessing the database from my laptop. Connection timeout continues.,Hardware,Please check whether your access credentials are valid.,am having trouble accessing the database from my laptop connection timeout continues
10,310,I have a problem with the performance of my computer. It's very slow going.,Hardware,"Maintenance is required, please contact the workstation support service. In case of critical failure, the device",have problem with the performance of my computer it's very slow going
11,323,"My computer is making strange noises, I'm worried that something might be wrong.",Hardware,"It is necessary to clean the system unit from dust. There are detailed instructions on the portal. If you are afraid to do it yourself, contact the workstation support service.",my computer making strange noises  worried that something might be wrong
12,324,"My computer is having problems with the mouse, it is very annoying.",Hardware,"Maintenance is required, please contact the workstation support service. In case of critical failure, the device",my computer having problems with the mouse it very annoying
13,326,"There is a problem with the keyboard on my computer, some keys are not working.",Hardware,"Maintenance is required, please contact the workstation support service. In case of critical failure, the device",there problem with the keyboard on my computer some keys not working
14,329,"My computer has problems with the camera, it doesn't work.",Hardware,Check if the current version of the device driver is installed. Detailed instructions are posted on the portal.,my computer has problems with the camera it doesn't work
15,331,"I have a problem with the cooling system on my computer, it makes strange noises.",Hardware,"It is necessary to clean the system unit from dust. There are detailed instructions on the portal. If you are afraid to do it yourself, contact the workstation support service.",have problem with the cooling system on my computer it makes strange noises
16,333,"There is a problem with my laptop battery, it won't hold the charge.",Hardware,"Maintenance is required, please contact the workstation support service. In case of critical failure, the device",there problem with my laptop battery it won't hold the charge
17,340,"I'm having trouble accessing the company's website. Every time I try to log in, it says that my credentials are incorrect.",Access,Please use the password reset utility. There is the instruction on the portal.,having trouble accessing the company's website every time try to log in it says that my credentials incorrect
18,348,I have a problem with the company's equipment. My computer won't boot and I can't access any files.,Hardware,"Maintenance is required, please contact the workstation support service. In case of critical failure, the device",have problem with the company's equipment my computer won't boot and can't access any files
19,354,"I have a problem with the installation of new equipment, it does not connect properly. Can you help?",Hardware,"Maintenance is required, please contact the workstation support service. In case of critical failure, the device",have problem with the installation of new equipment it does not connect properly can help
20,393,I have a problem with the company's hardware management. It doesn't work as expected. Can you help?,Hardware,Check if the current version of the device driver is installed. Detailed instructions are posted on the portal.,have problem with the company's hardware management it doesn't work as expected can help
21,415,My computer is running very slow and I can't figure out why. I tried restarting it but that didn't help.,Hardware,Run antivirus check and follow the antivirus' instructions. Let me know of the results.,my computer running very slow and can't figure out why tried restarting it but that didn't help
22,421,My computer freezes and I don't know what to do. I tried restarting it but the problem persists.,Hardware,Run antivirus check and follow the antivirus' instructions. Let me know of the results.,my computer freezes and don't know what to do tried restarting it but the problem persists
23,425,"I have a problem with the sound on my computer. I checked the parameters and everything is on record, but I still can't hear anything.",Hardware,Check if the current version of the device driver is installed. Detailed instructions are posted on the portal.,have problem with the sound on my computer checked the parameters and everything on record but still can't hear anything
24,429,"I have a problem with the camera on my computer. I checked the settings and everything is fine, but I still don't see anything.",Hardware,Check if the current version of the device driver is installed. Detailed instructions are posted on the portal.,have problem with the camera on my computer checked the settings and everything fine but still don't see anything
25,431,I have a problem with the printer. He doesn't answer and I don't know what to do.,Printer,"Maintenance is required, please contact the workstation support service. In case of critical failure, the device",have problem with the printer he doesn't answer and don't know what to do
26,433,"I have a problem with the microphone on my computer. I checked the parameters and everything is in the wey register, but I still can't hear anything.",Hardware,Check if the current version of the device driver is installed. Detailed instructions are posted on the portal.,have problem with the microphone on my computer checked the parameters and everything in the wey register but still can't hear anything
27,494,My computer is having sound problems.,Hardware,Check if the current version of the device driver is installed. Detailed instructions are posted on the portal.,my computer having sound problems
28,500,I have a problem with the screen resolution on my computer.,Hardware,Check if the current version of the device driver is installed. Detailed instructions are posted on the portal.,have problem with the screen resolution on my computer
29,557,I can't use the program because of the hardware problem. I need help finding hell.,Hardware,"Maintenance is required, please contact the workstation support service. In case of critical failure, the device",can't use the program because of the hardware problem need help finding hell
30,644,"My computer is making strange noises, I'm worried that something might be wrong.",Hardware,"It is necessary to clean the system unit from dust. There are detailed instructions on the portal. If you are afraid to do it yourself, contact the workstation support service.",my computer making strange noises  worried that something might be wrong
31,1544,"My laptop does not turn on, I tried to charge it, but nothing happens.",Hardware,The power supply is damaged and needs to be replaced. Contact your nearest service center.,my laptop does not turn on tried to charge it but nothing happens
32,1624,"I can't send it from my computer, it doesn't work.",Printer,"Please check if the printer is connected to your computer. If so, contact your system administrator.",can't send it from my computer it doesn't work
33,1972,"I can't print from my computer. The printer is connected, but it does not respond when I try to print.",Printer,Please contact your system administrator.,can't print from my computer the printer connected but it does not respond when try to print
34,1987,"I try to print the document, but the printout is completely faded and illegible.",Printer,"Please check if the printer is connected to your computer. If so, contact your system administrator.",try to print the document but the printout completely faded and illegible
35,2014,"I can't print from my device, I get a printer error message.",Printer,"Please check if the printer is connected to your computer. If so, contact your system administrator.",can't print from my device get printer error message
36,2051,"I can't connect to the company's VPN, it says invalid credentials.",Access,Please use the password reset utility. There is the instruction on the portal.,can't connect to the company's vpn it says invalid credentials
37,2251,"I can't connect to the company's VPN, it says invalid credentials.",Access,Please use the password reset utility. There is the instruction on the portal.,can't connect to the company's vpn it says invalid credentials
38,2987,My Sony PlayStation does not turn on. It makes strange noises and the LED on its front panel blinks twice.,Hardware,The power supply is broken and needs to be replaced. Contact your nearest service center.,my sony playstation does not turn on it makes strange noises and the led on its front panel blinks twice
39,2989,In which transaction can the documents generated as a result of planning operations be viewed separately? There was a crediting of one place of occurrence of costs through the performance of types of work for other facilities CO.,SAP,"It is necessary to check the box ""Planning integration"" in the version setting for a separate financial year (spro - > Controlling).
",in which transaction can the documents generated as result of planning operations be viewed separately there was crediting of one place of occurrence of costs through the performance of types of work for other facilities co
40,2990,"When calculating a CO-order for another BE (the recipient is the order of another BU) under the initial types of costs (32*,33*,34*,36*) automatic posting through the 79020000000 account contains the amount of only primary 32* and secondary costs of the type 33*, but does not take into account the amounts for secondary 34*, 36*.",SAP,"It is necessary to add secondary types of costs 34* and 36* to the CO-FI approval rule, KALH transaction.",when calculating co-order for another be (the recipient the order of another bu) under the initial types of costs (32*33*34*36*) automatic posting through the 79020000000 account contains the amount of only primary 32* and secondary costs of the type 33* but does not take into account the amounts for secondary 34* 36*
41,2992,"How to reflect in the purchase book the primary incoming May invoice FI (+), the reverse to it (-) and the corrective June invoice (+). All in one reporting period (2nd quarter).",SAP,"1. Reverse the original SF.
2. To reflect the correction with the same type of document, in the title text specify a 14-digit link to the original by type NNNNNNNNNYYYY, where NNNNNNNNNN is the system number of the original, YYYY is the year of the original.",how to reflect in the purchase book the primary incoming may invoice f(+) the reverse to it (-) and the corrective june invoice (+) all in one reporting period (2nd quarter)
42,2999,"Please tell me what could be the reason that when the FI documents are aligned on the account through the F-03 transaction from the balance position, the difference in a penny is not automatically deducted. Returns the error ""The reasons for the balance with automatic write-off are unacceptable here.""",SAP,"You specify the reason for the difference, for which the indicator ""Debit the difference through a separate account"" is indicated in the reason setting. The transaction of setting up the causes of the difference is OBBE. Uncheck this box for your reason or do not specify the reason in the alignment transaction at all.","please tell me what could be the reason that when the fdocuments aligned on the account through the f-03 transaction from the balance position the difference in penny not automatically deducted returns the error ""the reasons for the balance with automatic write-off unacceptable here"""
43,3001,How to create Purchase Requisition in SAP ECC,SAP,https://www.appseconnect.com/purchase-requisition-in-sap-ecc/,how to create purchase requisition in sap ecc
44,3002,I need help changing PR in transaction ME52N. It says 'Requisition X does not exist',SAP,https://help.sap.com/docs/SAP_S4HANA_ON-PREMISE/af9ef57f504840d2b81be8667206d485/c680b65334e6b54ce10000000a174cb4.html,need help changing pr in transaction me52n it says 'requisition x does not exist'
45,3006,"I am facing a Problem while creating a Purchase order with ref. to a Purchase Requistion.

System is showing an error ""Purchase requisitions of document_type ZVS or item category L may not be assigned to purchase orders of document type ZVS or item category L"".

Doc. type of Pur. Req. & PO is ZVS

Item Category for PR & PO is L",SAP,"SPRO-> Materials Management -> Purchasing -> Purchase order -> Define Document Types

Select your document type ZVS and click on allowed item categories & check whether item category L is assigned.

Then select link purchase requisition - document type. Here check whether your purchase requisition document type ZVS and item category L combination is maintained.","am facing problem while creating purchase order with ref to purchase requistion

system showing an error ""purchase requisitions of document_type zvs or item category l may not be assigned to purchase orders of document type zvs or item category l""

doc type of pur req & po zvs

item category for pr & po l"
46,3010,"Issue: Batch is not determining automatically at returns obd level.

Scenario: Before activating the batch process to material, we have sold 10 qty, . Now, after activation batch process, we got that material stock from customer level. Now, while creating returns obd to receive that qty, system is not triggering batch automatically.",SAP,"The goods are at your customer and have physically no batch, hence the system is not able to determine a batch automatically because it cannot look into your customers system, and even it could it would not find a batch.","issue: batch not determining automatically at returns obd level

scenario: before activating the batch process to material we have sold 10 qty  now after activation batch process we got that material stock from customer level now while creating returns obd to receive that qty system not triggering batch automatically"
47,3016,"My client want to implement pp module So as far material master is concerned what data & views I have to require for create material ,For which pp cycle the views from material master going to change, We having by co products & by products also , I search on sdn But not get satisfactory solution.",SAP,"To Implement PP module,the material master should have all MRP views.If you want to maintain co products,you should go to OMS2,Select required material type and in which you should restrict that no external purchase order not allowed and internal purchase order allowed.Then only that co product field will be appeared in MRP2 view.You should select that field.

Thanks and regards,",my client want to implement pp module so as far material master concerned what data & views have to require for create material for which pp cycle the views from material master going to change we having by co products & by products also  search on sdn but not get satisfactory solution
48,3018,"We are facing a weird issue :

For one particular user ""material group"" from material master is not defaulting into the PO. Material group field is blank.

For other users for the same material , material group is defaulting correctly. Initially we thought the problem is with the user ID , then to our wonder we found few PO's(created by same user) with multiple line items of the same material have material group defaulted correctly in line item 2,3,4 but not in line item 1.

Have any faced this kind of issue ?",SAP,"check how the user is creating PO, if they are referring the OLD PO then the old might be not having the material group for line item 1","we facing weird issue :

for one particular user ""material group"" from material master not defaulting into the po material group field blank

for other users for the same material  material group defaulting correctly initially we thought the problem with the user id  then to our wonder we found few po's(created by same user) with multiple line items of the same material have material group defaulted correctly in line item 234 but not in line item 1

have any faced this kind of issue"
49,3041,number - incoming cost at the beginning of the month - depreciation amount - cost at the end of the month. How to do it?,SAP,Use this report S_P99_41000192 - Depreciation carried out on the fixed asset and the transaction period,number - incoming cost at the beginning of the month - depreciation amount - cost at the end of the month how to do it
50,3051,"I can't log in to SAP, a network load balancing error occurs",Network,Check the network connection and the connection of your personal information security key,can't log in to sap network load balancing error occurs
51,3052,I received an email with a spam mailing list and a potentially malicious attachment to my corporate email. What do I need to do?,Network\security,do not open or forward the email to anyone and contact the information security service,received an email with spam mailing list and potentially malicious attachment to my corporate email what do need to do
